{
  "type": "object",
  "properties": {
    "id": {
      "type": "string",
      "minLength": 1,
      "pattern": "\\S"
    },
    "desired_outcome": {
      "type": "string",
      "minLength": 1,
      "pattern": "\\S"
    },
    "hard_constraints": {
      "type": "array",
      "items": {
        "type": "string",
        "minLength": 1,
        "pattern": "\\S"
      },
      "minItems": 1,
      "uniqueItems": true
    },
    "preferences": {
      "type": "array",
      "items": {
        "type": "string",
        "minLength": 1,
        "pattern": "\\S"
      },
      "minItems": 0,
      "uniqueItems": true
    },
    "non_goals": {
      "type": "array",
      "items": {
        "type": "string",
        "minLength": 1,
        "pattern": "\\S"
      },
      "minItems": 0,
      "uniqueItems": true
    },
    "decision_scenarios": {
      "type": "array",
      "items": {
        "type": "object",
        "properties": {
          "id": {
            "type": "string",
            "minLength": 1,
            "pattern": "\\S"
          },
          "situation": {
            "type": "string",
            "minLength": 1,
            "pattern": "\\S"
          },
          "expected_decision": {
            "type": "string",
            "minLength": 1,
            "pattern": "\\S"
          },
          "why": {
            "type": "string",
            "minLength": 1,
            "pattern": "\\S"
          }
        },
        "required": [
          "id",
          "situation",
          "expected_decision",
          "why"
        ],
        "additionalProperties": false
      },
      "minItems": 1,
      "uniqueItems": true
    }
  },
  "required": [
    "id",
    "desired_outcome",
    "hard_constraints",
    "preferences",
    "non_goals",
    "decision_scenarios"
  ],
  "additionalProperties": false,
  "$schema": "https://json-schema.org/draft/2020-12/schema",
  "title": "purpose"
}
